{"note":"Event years come from general historical knowledge and are not verified against World Bank documentation (UNVERIFIED). First observed years are computed from gdppc_const.","rows":[{"entity":"Sudan","event":"South Sudan seceded","event_evidence":"GENERAL_KNOWLEDGE","event_year":2011,"first_year_evidence":"DATA","first_year_observed":1960,"iso3":"SDN","sensitivity_only":false,"territory_break_year":2011,"treatment":"Series spans the pre-2011 territory; excluded from primary windows containing 2011, kept in sensitivity run."},{"entity":"South Sudan","event":"Independence from Sudan","event_evidence":"GENERAL_KNOWLEDGE","event_year":2011,"first_year_evidence":"DATA","first_year_observed":2008,"iso3":"SSD","sensitivity_only":true,"territory_break_year":null,"treatment":"Starts after independence; no pre-2011 history; absent from windows starting before its first year."},{"entity":"Ethiopia","event":"Eritrea independent (de facto 1991, formal 1993)","event_evidence":"GENERAL_KNOWLEDGE","event_year":1993,"first_year_evidence":"DATA","first_year_observed":1961,"iso3":"ETH","sensitivity_only":false,"territory_break_year":1993,"treatment":"Series before 1993 may include Eritrea; excluded from primary windows containing 1993."},{"entity":"Eritrea","event":"Independence from Ethiopia","event_evidence":"GENERAL_KNOWLEDGE","event_year":1993,"first_year_evidence":"DATA","first_year_observed":1992,"iso3":"ERI","sensitivity_only":true,"territory_break_year":null,"treatment":"Short, ends in 2011 in WDI; dropped from windows lacking start or end data."},{"entity":"Serbia","event":"Serbia and Montenegro dissolved","event_evidence":"GENERAL_KNOWLEDGE","event_year":2006,"first_year_evidence":"DATA","first_year_observed":1995,"iso3":"SRB","sensitivity_only":false,"territory_break_year":2006,"treatment":"Series history may cover the union; excluded from primary windows containing 2006."},{"entity":"Montenegro","event":"Independence from Serbia and Montenegro","event_evidence":"GENERAL_KNOWLEDGE","event_year":2006,"first_year_evidence":"DATA","first_year_observed":1997,"iso3":"MNE","sensitivity_only":true,"territory_break_year":null,"treatment":"Starts when WDI reports it; dropped from windows lacking start data."},{"entity":"Kosovo","event":"Declared independence from Serbia","event_evidence":"GENERAL_KNOWLEDGE","event_year":2008,"first_year_evidence":"DATA","first_year_observed":2008,"iso3":"XKX","sensitivity_only":true,"territory_break_year":null,"treatment":"WDI series starts 2008; not in windows starting earlier."},{"entity":"Germany","event":"Reunification","event_evidence":"GENERAL_KNOWLEDGE","event_year":1990,"first_year_evidence":"DATA","first_year_observed":1960,"iso3":"DEU","sensitivity_only":false,"territory_break_year":1991,"treatment":"First full unified year 1991; excluded from primary windows that start before 1991 (includes the 1960 and 1980 constant-USD windows and the 1990 PPP window)."},{"entity":"Yemen","event":"North and South Yemen unified","event_evidence":"GENERAL_KNOWLEDGE","event_year":1990,"first_year_evidence":"DATA","first_year_observed":1990,"iso3":"YEM","sensitivity_only":false,"territory_break_year":1990,"treatment":"Pre-1990 constant-USD history may combine two states; excluded from the 1960 and 1980 windows."},{"entity":"Pakistan","event":"Bangladesh independence","event_evidence":"GENERAL_KNOWLEDGE","event_year":1971,"first_year_evidence":"DATA","first_year_observed":1960,"iso3":"PAK","sensitivity_only":false,"territory_break_year":1971,"treatment":"Pre-1972 territory included East Pakistan; excluded from the 1960 window."},{"entity":"Bangladesh","event":"Independence from Pakistan","event_evidence":"GENERAL_KNOWLEDGE","event_year":1971,"first_year_evidence":"DATA","first_year_observed":1960,"iso3":"BGD","sensitivity_only":false,"territory_break_year":1971,"treatment":"Pre-1972 history may be a reconstruction; excluded from the 1960 window."},{"entity":"Czechia","event":"Czechoslovakia dissolved","event_evidence":"GENERAL_KNOWLEDGE","event_year":1993,"first_year_evidence":"DATA","first_year_observed":1990,"iso3":"CZE","sensitivity_only":false,"territory_break_year":null,"treatment":"WDI reports successor-territory values from 1990 (reconstruction); included when observed at window start."},{"entity":"Slovak Republic","event":"Czechoslovakia dissolved","event_evidence":"GENERAL_KNOWLEDGE","event_year":1993,"first_year_evidence":"DATA","first_year_observed":1990,"iso3":"SVK","sensitivity_only":false,"territory_break_year":null,"treatment":"As Czechia."},{"entity":"Russian Federation","event":"USSR dissolved","event_evidence":"GENERAL_KNOWLEDGE","event_year":1991,"first_year_evidence":"DATA","first_year_observed":1989,"iso3":"RUS","sensitivity_only":false,"territory_break_year":null,"treatment":"Reconstructed values for 1990 onwards; included when observed at window start. 15 successor states share this treatment."},{"entity":"Ukraine","event":"USSR dissolved","event_evidence":"GENERAL_KNOWLEDGE","event_year":1991,"first_year_evidence":"DATA","first_year_observed":1987,"iso3":"UKR","sensitivity_only":false,"territory_break_year":null,"treatment":"As Russian Federation."},{"entity":"Croatia","event":"Yugoslavia dissolved","event_evidence":"GENERAL_KNOWLEDGE","event_year":1991,"first_year_evidence":"DATA","first_year_observed":1990,"iso3":"HRV","sensitivity_only":false,"territory_break_year":null,"treatment":"Reconstructed early values; included when observed at window start. The six successor states share this treatment."},{"entity":"Slovenia","event":"Yugoslavia dissolved","event_evidence":"GENERAL_KNOWLEDGE","event_year":1991,"first_year_evidence":"DATA","first_year_observed":1990,"iso3":"SVN","sensitivity_only":false,"territory_break_year":null,"treatment":"As Croatia."},{"entity":"North Macedonia","event":"Yugoslavia dissolved","event_evidence":"GENERAL_KNOWLEDGE","event_year":1991,"first_year_evidence":"DATA","first_year_observed":1990,"iso3":"MKD","sensitivity_only":false,"territory_break_year":null,"treatment":"As Croatia."},{"entity":"Bosnia and Herzegovina","event":"Yugoslavia dissolved","event_evidence":"GENERAL_KNOWLEDGE","event_year":1992,"first_year_evidence":"DATA","first_year_observed":1990,"iso3":"BIH","sensitivity_only":false,"territory_break_year":null,"treatment":"As Croatia."},{"entity":"Timor-Leste","event":"Independence from Indonesia","event_evidence":"GENERAL_KNOWLEDGE","event_year":2002,"first_year_evidence":"DATA","first_year_observed":1990,"iso3":"TLS","sensitivity_only":false,"territory_break_year":null,"treatment":"WDI series starts before independence; included when observed at window start, with the caveat that early values are for a non-sovereign territory."},{"entity":"Curacao","event":"Netherlands Antilles dissolved","event_evidence":"GENERAL_KNOWLEDGE","event_year":2010,"first_year_evidence":"DATA","first_year_observed":2000,"iso3":"CUW","sensitivity_only":true,"territory_break_year":null,"treatment":"Starts 2000; not in windows starting earlier."},{"entity":"Sint Maarten (Dutch part)","event":"Netherlands Antilles dissolved","event_evidence":"GENERAL_KNOWLEDGE","event_year":2010,"first_year_evidence":"DATA","first_year_observed":2009,"iso3":"SXM","sensitivity_only":true,"territory_break_year":null,"treatment":"Starts 2009; not in windows starting earlier."}],"schema_version":"v1","tags":{"rows":"DERIVED"},"windows":[{"end":2025,"excluded":["DEU","ETH","SDN","SRB"],"start":1990},{"end":2025,"excluded":["SDN","SRB"],"start":2000},{"end":2025,"excluded":["SDN"],"start":2010},{"end":2024,"excluded":["BGD","DEU","ETH","PAK","SDN","SRB","YEM"],"start":1960},{"end":2024,"excluded":["DEU","ETH","SDN","SRB","YEM"],"start":1980},{"end":2024,"excluded":["SDN","SRB"],"start":2000}]}
